{
  "auth_enabled": false,
  "auth_provider": "local",
  "local_auth": {
    "jwt_secret_key": "spr_secret_key_please_change_this",
    "users": [
      {
        "username": "spr_test_user",
        "password": "spr_test_password"
      }
    ]
  },
  "oidc_auth": {
    "realm_url": "http://localhost:8080/realms/sapporo-dev",
    "username_claim": "sub"
  }
}
